{
  "$schema": "./secret-references.schema.json",
  "schemaVersion": "0.1.0",
  "profile": {
    "id": "oh-my-harness-local-baseline",
    "description": "Commit-safe baseline for recreating oh-my-harness local Pi capabilities without storing private values.",
    "packageIntents": [
      {
        "name": "oh-my-harness",
        "installSpec": "git:github.com/zzanghyunmoo/oh-my-harness",
        "intent": "core-profile",
        "commitPolicy": "committed-reference-only",
        "notes": "The package represented by this repository. Runtime extension list remains in package.json."
      },
      {
        "name": "pi-clear",
        "installSpec": "npm:pi-clear",
        "intent": "manual-signal",
        "commitPolicy": "committed-reference-only",
        "notes": "Recent manual package install signal: pi install npm:pi-clear. This records profile intent only; it does not add a package.json Pi extension."
      }
    ]
  },
  "environment": {
    "toggles": [
      {
        "name": "ENABLE_QUOTIO",
        "capability": "extensions/quotio-provider",
        "kind": "toggle",
        "requiredWhen": "Set to true only on machines that should register the Quotio LiteLLM provider.",
        "valueBoundary": "boolean-toggle",
        "localValueSource": "CWD .env or pre-existing process environment",
        "commitPolicy": "name-and-intent-only",
        "notes": "The env-loader reads CWD .env first and overrides process.env."
      },
      {
        "name": "ENABLE_WORKSPACE_CONNECTORS",
        "capability": "extensions/workspace-connectors",
        "kind": "toggle",
        "requiredWhen": "Set to true only on machines that should expose Linear/Notion OAuth MCP connector commands and tools.",
        "valueBoundary": "boolean-toggle",
        "localValueSource": "CWD .env or pre-existing process environment",
        "commitPolicy": "name-and-intent-only",
        "notes": "Connector OAuth state remains local and must be recreated per machine."
      },
      {
        "name": "ENABLE_WORKSPACE_CLI_TOOLS",
        "capability": "extensions/workspace-cli-tools",
        "kind": "toggle",
        "requiredWhen": "Set to true on Pi machines that should expose the role-scoped Jira, Linear, GitHub, GitLab, Confluence, Notion, and CodeRabbit CLI tools.",
        "valueBoundary": "boolean-toggle",
        "localValueSource": "CWD .env or pre-existing process environment",
        "commitPolicy": "name-and-intent-only",
        "notes": "External CLI credentials remain owned by each CLI and are never stored by oh-my-harness."
      }
    ],
    "configuration": [
      {
        "name": "QUOTIO_BASE_URL",
        "capability": "extensions/quotio-provider",
        "kind": "endpoint",
        "requiredWhen": "Required when ENABLE_QUOTIO is true.",
        "valueBoundary": "local-endpoint",
        "localValueSource": "CWD .env or pre-existing process environment",
        "commitPolicy": "never-commit-value",
        "notes": "Treat as local configuration that may reveal private network topology. Commit only the key name and intent."
      },
      {
        "name": "GITLAB_HOST",
        "capability": "extensions/workspace-connectors",
        "kind": "endpoint",
        "requiredWhen": "Optional when the company GitLab instance is not the glab default context.",
        "valueBoundary": "local-endpoint",
        "localValueSource": "CWD .env or pre-existing process environment",
        "commitPolicy": "name-and-intent-only",
        "notes": "Host name only; do not pair it with tokens in committed files."
      }
    ],
    "secrets": [
      {
        "name": "QUOTIO_API_KEY",
        "capability": "extensions/quotio-provider",
        "kind": "api-key",
        "requiredWhen": "Required when ENABLE_QUOTIO is true.",
        "valueBoundary": "secret-token",
        "localValueSource": "CWD .env or pre-existing process environment",
        "commitPolicy": "never-commit-value",
        "notes": "Authentication token for the configured Quotio/OpenAI-compatible proxy."
      }
    ]
  },
  "oauthStateBoundaries": [
    {
      "service": "linear",
      "capability": "extensions/workspace-connectors",
      "loginCommand": "/connector-login linear",
      "stateBoundary": "mcp-remote and Pi OAuth/session files are machine-local and may appear in local auth stores such as .mcp-auth/, .pi/, or home-directory auth locations.",
      "commitPolicy": "never-commit-oauth-state",
      "recreateBy": "Enable workspace connectors locally, then run /connector-login linear and complete the browser/terminal OAuth flow on that machine."
    },
    {
      "service": "notion",
      "capability": "extensions/workspace-connectors",
      "loginCommand": "/connector-login notion",
      "stateBoundary": "mcp-remote and Pi OAuth/session files are machine-local and may appear in local auth stores such as .mcp-auth/, .pi/, or home-directory auth locations.",
      "commitPolicy": "never-commit-oauth-state",
      "recreateBy": "Enable workspace connectors locally, then run /connector-login notion and complete the browser/terminal OAuth flow on that machine."
    }
  ],
  "localOnlyPaths": [
    {
      "path": ".env",
      "reason": "CWD environment file containing toggles, endpoint values, and API keys.",
      "commitPolicy": "never-commit"
    },
    {
      "path": ".env.*",
      "reason": "Potential environment variants that can contain secrets or private endpoints.",
      "commitPolicy": "never-commit"
    },
    {
      "path": ".mcp-auth/",
      "reason": "OAuth state/cache for remote MCP connectors.",
      "commitPolicy": "never-commit"
    },
    {
      "path": ".pi/",
      "reason": "Local Pi session/OAuth state generated while using connectors.",
      "commitPolicy": "never-commit"
    },
    {
      "path": "~/.pi/agent/auth.json",
      "reason": "Pi agent authentication material outside the repository.",
      "commitPolicy": "never-commit"
    },
    {
      "path": "~/.pi/agent/workspace-connectors-auth.json",
      "reason": "Local OAuth token store for workspace connector browser OAuth.",
      "commitPolicy": "never-commit"
    },
    {
      "path": "~/.pi/agent/workspace-connectors-setup.json",
      "reason": "Secret-free but machine-local connector setup mode/selection state.",
      "commitPolicy": "never-commit"
    }
  ],
  "recreateOnAnotherMachine": [
    "Install oh-my-harness with pi install git:github.com/zzanghyunmoo/oh-my-harness or the private SSH equivalent.",
    "If this profile should include the manual package signal, install pi-clear with pi install npm:pi-clear.",
    "Create a local CWD .env with ENABLE_QUOTIO, ENABLE_WORKSPACE_CONNECTORS, and/or ENABLE_WORKSPACE_CLI_TOOLS set to true only for capabilities needed on that machine.",
    "When Quotio is enabled, set local QUOTIO_BASE_URL and QUOTIO_API_KEY values in CWD .env or another local environment source.",
    "When workspace connectors are enabled, run /connector-login linear and/or /connector-login notion on that machine to recreate OAuth state.",
    "Run /connector-setup full, selective, or minimal on that machine to record local connector setup intent."
  ]
}
